<?xml version="1.0" encoding="UTF-8"?>
<!-- play group:0, enemyGroup :1 -->
<root
    xmlns:xsi='http://www.w3.org/2001/XMLSchema-instance'
    xmlns='http://fighter.huliqing.name'
    xsi:schemaLocation='http://fighter.huliqing.name meta/module.xsd'>
    
    
    <moduleActor id="moduleActor" />
    <moduleAction id="moduleAction" />
    <moduleAttribute id="moduleAttribute"/>
    <moduleChannel id="moduleChannel"/>
    <moduleChat id="moduleChat"/>
    <moduleItem id="moduleItem"/>
    <moduleLogic id="moduleLogic"/>
    <modulePhysics id="modulePhysics" />
    <moduleResist id="moduleResist" />
    <moduleSkill id="moduleSkill"/>
    <moduleSkin id="moduleSkin"/>
    <moduleState id="moduleState"/>
    <moduleTalent id="moduleTalent"/>
    <moduleTask id="moduleTask"/>
        

</root>
